num_topics,topic_id,words
5,0,"allah, bumi, langit, air, maha, orang-orang, engkau, menjadikan, kaum, tanda-tanda, benar-benar, manusia, menciptakan, malam, mati"
5,1,"orang-orang, allah, beriman, orang, azab, neraka, kafir, kufur, nabi, dunia, kepadamu, sungguh, jalan, muhammad, berbuat"
5,2,"allah, maha, orang-orang, kepadamu, orang, penyayang, bumi, nabi, tuhan, pengampun, beriman, muhammad, engkau, berbuat, kepada-nya"
5,3,"allah, engkau, nabi, orang-orang, muhammad, kepadamu, alquran, sungguh, orang, benar-benar, manusia, tuhan, petunjuk, kitab, tuhanmu"
5,4,"allah, perempuan, laki-laki, orang, anak, orang-orang, harta, engkau, bagimu, saudara, anak-anak, maha, kepadamu, istri, hamba"
10,0,"allah, orang-orang, petunjuk, orang, beriman, nabi, muhammad, alquran, agama, kitab, jalan, engkau, manusia, mengikuti, menjadikan"
10,1,"allah, orang-orang, beriman, orang, maha, kepadamu, nabi, mukmin, muhammad, berbuat, niscaya, jalan, berperang, rasul-nya, kafir"
10,2,"engkau, nabi, muhammad, allah, kepadamu, orang-orang, alquran, sungguh, kitab, tuhan, rasul, benar-benar, tuhanmu, peringatan, manusia"
10,3,"orang-orang, allah, engkau, sungguh, benar-benar, kaum, azab, orang, zalim, negeri, beriman, kepadamu, berbuat, tipu, kafir"
10,4,"allah, maha, bumi, langit, tuhan, kehendaki, tuhanmu, manusia, menciptakan, penyayang, engkau, menjadikan, nabi, kepada-nya, benar-benar"
10,5,"allah, orang-orang, azab, neraka, orang, dunia, kufur, akhirat, manusia, kiamat, kehidupan, beriman, balasan, kafir, kerjakan"
10,6,"air, allah, engkau, bumi, musa, langit, hujan, kaum, tanda-tanda, benar-benar, orang-orang, ingatlah, orang, berfirman, kebesaran"
10,7,"allah, orang, anak, kepadamu, maha, orang-orang, hewan, engkau, ibrahim, bagimu, nama, ingatlah, manusia, daging, tuhanmu"
10,8,"perempuan, allah, laki-laki, maha, anak, saudara, orang, orang-orang, bagimu, harta, anak-anak, istri, perempuan-perempuan, hamba, sahaya"
10,9,"orang-orang, allah, surga, dalamnya, beriman, engkau, neraka, sungai-sungai, kekal, tuhan, saleh, mengalir, bawahnya, kepadamu, orang"
15,0,"orang-orang, allah, orang, engkau, beriman, azab, kaum, nabi, muhammad, kafir, sungguh, kepadamu, zalim, benar-benar, petunjuk"
15,1,"allah, bumi, langit, maha, menciptakan, manusia, hewan, menjadikan, tuhan, air, mati, daging, makhluk, kuasa, kepadamu"
15,2,"allah, manusia, menjadikan, orang-orang, ingatlah, kepadamu, tuhanmu, berfirman, engkau, setan, golongan, jin, nikmat, orang, adam"
15,3,"allah, malam, engkau, maha, tanda-tanda, siang, orang, langit, bumi, matahari, menjadikan, kebesaran, tuhanmu, benar-benar, orang-orang"
15,4,"perempuan, allah, laki-laki, anak, orang, harta, orang-orang, saudara, anak-anak, istri, perempuan-perempuan, bagimu, sahaya, hamba, suami"
15,5,"allah, orang-orang, orang, berbuat, beriman, kepadamu, haji, adil, wajib, bertakwalah, melanggar, nabi, miskin, benar-benar, berpuasa"
15,6,"musa, engkau, kepadamu, allah, orang-orang, orang, fir'aun, kaum, sungguh, ingatlah, benar-benar, israil, membawa, bani, tipu"
15,7,"orang-orang, allah, beriman, surga, dalamnya, neraka, kekal, sungai-sungai, mengalir, saleh, bawahnya, pahala, beramal, tuhan, balasan"
15,8,"engkau, allah, tuhan, maha, tuhanku, nabi, ibrahim, muhammad, kepadaku, kepadamu, musa, anak, orang-orang, ingatlah, manusia"
15,9,"orang-orang, allah, azab, neraka, dunia, orang, kehidupan, manusia, kiamat, kufur, akhirat, engkau, kafir, ayat-ayat, jahanam"
15,10,"allah, orang-orang, kepadamu, maha, petunjuk, tuhanmu, tuhan, orang, bagimu, berbuat, engkau, bumi, muhammad, kepada-nya, jalan"
15,11,"allah, orang-orang, nabi, muhammad, alquran, kepadamu, engkau, kitab, beriman, sungguh, rasul, benar-benar, kebenaran, petunjuk, orang"
15,12,"air, hujan, allah, bumi, langit, pohon, kaum, angin, menurunkan, awan, batu, kurma, menumbuhkan, tanaman, kebun"
15,13,"allah, maha, orang-orang, penyayang, pengampun, nabi, niscaya, kepadamu, kehendaki, bumi, bijaksana, perkasa, beriman, muhammad, orang"
15,14,"allah, orang-orang, orang, berbuat, salat, beriman, jalan, nabi, berperang, kebaikan, bumi, muhammad, maha, takut, kufur"
20,0,"allah, api, manusia, air, menjadikan, berfirman, neraka, engkau, kepadamu, jin, menciptakan, adam, ingatlah, bumi, langit"
20,1,"allah, orang-orang, nabi, muhammad, kitab, alquran, kepadamu, petunjuk, beriman, sungguh, agama, manusia, tuhan, benar-benar, kebenaran"
20,2,"allah, orang-orang, engkau, nabi, muhammad, orang, petunjuk, beriman, alquran, sungguh, kafir, benar-benar, hati, ayat-ayat, tipu"
20,3,"nabi, engkau, muhammad, kepadamu, allah, tuhanmu, alquran, orang-orang, peringatan, manusia, pemberi, maha, rasul, tuhan, sungguh"
20,4,"engkau, musa, tuhanku, yusuf, ibrahim, anak, kepadaku, orang, allah, ingatlah, berfirman, orang-orang, sapi, tuhan, berdoa"
20,5,"allah, bumi, langit, malam, siang, maha, tanda-tanda, kebesaran, menciptakan, matahari, benar-benar, tuhan, engkau, menjadikan, kekuasaan"
20,6,"perempuan, laki-laki, allah, anak, harta, saudara, orang, orang-orang, maha, sahaya, hamba, anak-anak, perempuan-perempuan, istri, bagimu"
20,7,"allah, hewan, daging, nama, orang-orang, ternak, orang, bagimu, disembelih, dosa, batas, diharamkan, perbuatan, perempuan, rumah"
20,8,"orang-orang, kaum, allah, engkau, benar-benar, sungguh, kepadamu, azab, rasul, tuhan, fir'aun, musa, orang, nyata, zalim"
20,9,"orang-orang, golongan, allah, negeri, musa, bala, fir'aun, engkau, orang, bani, salat, kepadamu, beriman, israil, tuhanmu"
20,10,"allah, orang-orang, kepadamu, setan, surga, berdua, bagimu, orang, neraka, maha, dosa, berfirman, menjadikan, pakaian, kerjakan"
20,11,"orang-orang, allah, orang, beriman, alquran, nabi, engkau, manusia, kepadamu, muhammad, kitab, kabar, ingatlah, menjadikan, gembira"
20,12,"allah, orang-orang, kepadamu, orang, beriman, perang, maha, manusia, rasul, muhammad, rasul-nya, niscaya, nabi, salat, bagimu"
20,13,"orang-orang, surga, allah, dalamnya, beriman, sungai-sungai, mengalir, bawahnya, kekal, saleh, tuhan, beramal, surga-surga, bertakwa, balasan"
20,14,"orang-orang, neraka, allah, azab, dunia, kiamat, kufur, engkau, kehidupan, kafir, ayat-ayat, akhirat, orang, jahanam, beriman"
20,15,"allah, orang-orang, berbuat, salat, orang, engkau, beriman, bumi, kebaikan, ketentuan, bertakwa, jalan, rezeki, nabi, kitab"
20,16,"orang-orang, allah, beriman, azab, orang, jalan, kafir, dunia, niscaya, berbuat, berperang, nabi, mukmin, kufur, muhammad"
20,17,"allah, orang, orang-orang, kepadamu, maha, engkau, berbuat, adil, beriman, ingatlah, nabi, sungguh, dosa, saksi, manusia"
20,18,"bumi, allah, langit, air, hujan, mati, menjadikan, menurunkan, manusia, maha, menciptakan, angin, benar-benar, engkau, awan"
20,19,"maha, allah, penyayang, bumi, pengampun, kehendaki, langit, tuhan, perkasa, bijaksana, orang-orang, tuhanmu, kepadamu, nabi, kepada-nya"
25,0,"orang-orang, neraka, surga, allah, dalamnya, sungai-sungai, kekal, mengalir, bawahnya, beriman, api, tuhan, saleh, jahanam, beramal"
25,1,"anak, musa, harta, allah, engkau, berfirman, perempuan, orang, saudara, kepadamu, sapi, ingatlah, laki-laki, menjadikan, patung"
25,2,"allah, orang-orang, orang, mukmin, berperang, maha, jalan, beriman, kepadamu, harta, rasul-nya, niscaya, perang, kaum, munafik"
25,3,"air, hujan, allah, angin, batu, langit, bumi, awan, engkau, menurunkan, mata, laut, maha, kapal, orang-orang"
25,4,"allah, kepadamu, nabi, sungguh, benar-benar, muhammad, orang-orang, engkau, kitab, rasul, manusia, tuhanmu, alquran, maryam, membawa"
25,5,"orang-orang, allah, dunia, berbuat, akhirat, kehidupan, beriman, orang, balasan, azab, pahala, kebaikan, kerjakan, saleh, bumi"
25,6,"orang-orang, allah, beriman, orang, kafir, neraka, nabi, kitab, muhammad, azab, kepadamu, manusia, kufur, musyrik, diturunkan"
25,7,"engkau, allah, nabi, muhammad, orang-orang, maha, orang, tuhan, kepadamu, petunjuk, tuhanku, kepadaku, tuhanmu, ampunan, kehendaki"
25,8,"nabi, muhammad, orang-orang, alquran, allah, kepadamu, engkau, kitab, peringatan, beriman, kebenaran, rasul, sungguh, diturunkan, petunjuk"
25,9,"allah, orang-orang, engkau, kepadamu, yusuf, surga, berbuat, niscaya, maha, keselamatan, semoga, malaikat, darinya, masuk, seandainya"
25,10,"tujuh, orang, yusuf, tuhanku, engkau, orang-orang, kepadaku, sapi, setan, kepadamu, pohon, tipu, sungguh, salah, daya"
25,11,"allah, manusia, jin, tuhanmu, daging, setan, adam, manakah, nikmat, hewan, berfirman, nama, darah, air, pohon"
25,12,"kaum, orang-orang, allah, engkau, negeri, benar-benar, sungguh, penduduk, azab, kaumku, bumi, musa, orang, kepadamu, nyata"
25,13,"engkau, musa, fir'aun, orang, israil, bani, tuhan, benar-benar, yusuf, membawa, makanan, aun, kaum, tuhanmu, fir"
25,14,"allah, maha, orang, orang-orang, harta, istri, dosa, perempuan, anak, saksi, patut, mahar, kesaksian, kafir, suami"
25,15,"malam, siang, allah, tanda-tanda, matahari, kebesaran, menjadikan, engkau, tuhanmu, kaum, benar-benar, langit, kekuasaan, tanda, bumi"
25,16,"allah, orang-orang, orang, petunjuk, engkau, jalan, nabi, muhammad, menjadikan, manusia, mengikuti, kehendaki, sesat, lurus, hati"
25,17,"allah, orang-orang, salat, bagimu, beriman, kepadamu, rezeki, maha, zakat, melaksanakan, orang, dosa, malam, hamba, miskin"
25,18,"allah, kepadamu, ingatlah, manusia, benar-benar, sungguh, orang-orang, engkau, orang, karunia, berfirman, ibrahim, maha, mengajarkan, niscaya"
25,19,"perempuan, laki-laki, allah, anak-anak, saudara, bagimu, rumah, hamba, sahaya, perempuan-perempuan, orang-orang, maha, beriman, saudara-saudara, orang"
25,20,"allah, orang-orang, engkau, beriman, kepadamu, nabi, maha, kafir, hati, muhammad, niscaya, azab, seandainya, orang, mukmin"
25,21,"bumi, allah, langit, air, hujan, mati, tanda-tanda, menciptakan, manusia, menjadikan, kebesaran, mengeluarkan, ternak, kaum, benar-benar"
25,22,"maha, allah, bumi, langit, tuhan, penyayang, kehendaki, perkasa, pengampun, bijaksana, tuhanmu, muhammad, nabi, kepada-nya, menciptakan"
25,23,"allah, orang-orang, tuhan, ibrahim, kepada-nya, agama, golongan, ingatlah, beriman, kabar, maha, alam, takut, gembira, kepadamu"
25,24,"orang-orang, allah, azab, sungguh, kafir, beriman, kufur, nabi, zalim, benar-benar, tipu, orang, muhammad, pedih, dunia"
30,0,"allah, orang-orang, azab, orang, kufur, bumi, maha, sungguh, dosa, kafir, berbuat, pedih, kiamat, ayat-ayat, zalim"
30,1,"perempuan, allah, orang-orang, laki-laki, hamba, sahaya, mukmin, perempuan-perempuan, beriman, kafir, orang, maha, suami, kaum, keji"
30,2,"perempuan, laki-laki, allah, saudara, rumah, anak-anak, anak, saudara-saudara, bagimu, ibumu, menjadikan, ayah, orang, kepadamu, miliki"
30,3,"allah, orang-orang, azab, kepadamu, orang, balasan, berbuat, kerjakan, neraka, surga, amal, beriman, tuhanmu, kiamat, saleh"
30,4,"allah, orang-orang, orang, berbuat, beriman, salat, harta, jalan, kebaikan, zakat, kepadamu, rezeki, miskin, pahala, rasul"
30,5,"allah, maha, engkau, bumi, langit, tuhan, nabi, tuhanmu, petunjuk, kepada-nya, muhammad, kehendaki, menciptakan, menjadikan, manusia"
30,6,"orang-orang, neraka, surga, dalamnya, allah, kekal, sungai-sungai, beriman, mengalir, bawahnya, tuhan, azab, api, beramal, saleh"
30,7,"allah, orang-orang, salat, engkau, nabi, kabar, gembira, takut, ibrahim, kepadamu, orang, ingatlah, muhammad, anak, harta"
30,8,"allah, orang-orang, tipu, daya, engkau, nabi, muhammad, orang, niscaya, keras, sungguh, kafir, azab, dunia, negeri"
30,9,"orang-orang, kitab, alquran, allah, kepadamu, engkau, benar-benar, orang, sungguh, nabi, muhammad, suci, beriman, petunjuk, manusia"
30,10,"allah, malam, siang, maha, tanda-tanda, menjadikan, bersyukur, manusia, bagimu, matahari, tuhanmu, kebesaran, mencari, benar-benar, untukmu"
30,11,"engkau, kepadamu, ingatlah, tuhanmu, manusia, jin, berfirman, nikmat, musa, orang, manakah, allah, tujuh, burung, kepadaku"
30,12,"allah, maha, bumi, orang-orang, langit, muhammad, nabi, kepadamu, hati, tuhanmu, urusan, menjadikan, malaikat, kepada-nya, azab"
30,13,"allah, kepadamu, orang-orang, maryam, isa, tuhan, putra, ingatlah, perjanjian, membunuh, membawa, alam, api, semesta, melanggar"
30,14,"engkau, tuhanku, yusuf, maha, tuhan, kepadaku, berdoa, orang, anak, musa, allah, makanan, saudaranya, orang-orang, raja"
30,15,"allah, nabi, muhammad, kepadamu, sungguh, benar-benar, engkau, rasul, orang-orang, membawa, musa, nyata, kitab, kebenaran, alquran"
30,16,"bumi, langit, air, allah, hujan, mati, tanda-tanda, kebesaran, menurunkan, benar-benar, angin, rezeki, kaum, menjadikan, awan"
30,17,"nabi, muhammad, allah, orang-orang, alquran, engkau, kepadamu, beriman, diturunkan, peringatan, kitab, manusia, pemberi, rasul, maha"
30,18,"allah, hewan, bagimu, maha, orang-orang, nama, ternak, kepadamu, ketentuan, daging, beriman, patut, batas, orang, istri"
30,19,"allah, orang-orang, orang, israil, engkau, fir'aun, musa, bani, saksi, bumi, berbuat, laki-laki, fir, aun, bala"
30,20,"maha, allah, penyayang, pengampun, bijaksana, perkasa, kehendaki, orang-orang, kepadamu, niscaya, bumi, tuhan, beriman, tuhanmu, tobat"
30,21,"orang-orang, kaum, engkau, negeri, azab, allah, beriman, fir'aun, benar-benar, zalim, orang, penduduk, kaumnya, sungguh, musa"
30,22,"allah, wajib, air, maha, orang, sakit, berpuasa, haji, perjalanan, penglihatan, hati, bagimu, debu, mata, golongan"
30,23,"allah, orang-orang, beriman, agama, orang, setan, kafir, jalan, golongan, menjadikan, petunjuk, mengikuti, musyrik, yahudi, zalim"
30,24,"allah, orang-orang, nabi, kepadamu, engkau, muhammad, tuhan, manusia, tuhanmu, dunia, orang, kiamat, kufur, rezeki, azab"
30,25,"orang-orang, allah, dunia, kehidupan, akhirat, orang, azab, neraka, benar-benar, beriman, kiamat, menjadikan, jahanam, sungguh, manusia"
30,26,"anak, harta, orang, musa, perempuan, saudara, allah, laki-laki, kepadamu, sapi, anak-anak, ditinggalkan, ingatlah, berfirman, tuhanmu"
30,27,"orang-orang, allah, engkau, nabi, muhammad, orang, petunjuk, beriman, kepadamu, kafir, niscaya, hati, sungguh, mengikuti, kebenaran"
30,28,"allah, manusia, jadikan, air, benar-benar, daging, ditentukan, kepadamu, tanah, mani, menjadikan, seandainya, menciptakan, umat, maha"
30,29,"allah, orang-orang, berperang, kepadamu, beriman, niscaya, benar-benar, orang, sungguh, jalan, mukmin, maha, perang, manusia, rasul-nya"
35,0,"allah, bumi, cahaya, orang-orang, ingatlah, orang, dalamnya, pohon, langit, perjanjian, taurat, perumpamaan, suci, pelita, tumbuh"
35,1,"air, langit, bumi, hujan, allah, menurunkan, mati, engkau, angin, menjadikan, manusia, tanah, kering, awan, dengannya"
35,2,"allah, manusia, maha, tuhanmu, ingatlah, kepadamu, api, malaikat, ibrahim, orang-orang, ampunan, engkau, berfirman, orang, menjadikan"
35,3,"allah, muhammad, nabi, tuhan, orang-orang, engkau, kepada-nya, langit, bumi, manusia, kepadamu, sungguh, malaikat, kepadaku, menjadikan"
35,4,"orang-orang, allah, beriman, orang, nabi, muhammad, azab, sungguh, kafir, rasul-nya, benar-benar, mukmin, kufur, musyrik, agama"
35,5,"allah, haji, wajib, orang-orang, berpuasa, perjalanan, orang, hewan, sakit, suci, hadyu, air, manusia, bagimu, beriman"
35,6,"allah, hewan, nama, daging, ternak, batas, disembelih, bagimu, kepadamu, maha, orang, melampaui, untukmu, diharamkan, makanlah"
35,7,"allah, orang-orang, orang, salat, saksi, kepadamu, engkau, muhammad, sungguh, nabi, kufur, alquran, bersamamu, sihir, niscaya"
35,8,"berfirman, kepadamu, negeri, allah, berdua, gunung, adam, ingatlah, surga, musa, setan, pakaian, indah, anak, engkau"
35,9,"orang-orang, allah, mukmin, golongan, orang, manusia, tuhanmu, kaum, nikmat, jin, hamba, manakah, beriman, sahaya, kafir"
35,10,"orang-orang, allah, dunia, manusia, azab, orang, engkau, kehidupan, jalan, akhirat, zalim, kebenaran, sungguh, kufur, menjadikan"
35,11,"allah, azab, orang-orang, dunia, akhirat, kehidupan, maha, ditimpa, manusia, kepadamu, nabi, pedih, beriman, bumi, niscaya"
35,12,"allah, kepadamu, berbuat, sungguh, orang-orang, kaumku, bumi, orang, engkau, bagimu, tuhanku, musa, nyata, tuhanmu, tuhan"
35,13,"allah, orang-orang, kepadamu, engkau, malaikat, gua, tangan, golongan, bagimu, kanan, seandainya, niscaya, ingatlah, kiri, rezeki"
35,14,"allah, orang-orang, maha, tipu, orang, daya, sungguh, benar-benar, nabi, muhammad, yusuf, menerima, niscaya, penyayang, tobat"
35,15,"orang, anak, harta, perempuan, allah, saudara, laki-laki, ditinggalkan, meninggal, tuanya, maha, wasiat, waris, ahli, kepadamu"
35,16,"orang-orang, allah, petunjuk, orang, kaum, mendustakan, ayat-ayat, engkau, azab, zalim, jalan, bumi, kehendaki, rasul, nabi"
35,17,"engkau, salat, malam, orang-orang, tuhanmu, allah, yusuf, zakat, maha, nabi, ingatlah, melaksanakan, musa, bertasbihlah, matahari"
35,18,"orang-orang, allah, azab, kiamat, kerjakan, neraka, orang, engkau, takut, musa, balasan, kafir, kufur, manusia, zalim"
35,19,"perempuan, laki-laki, allah, orang-orang, sahaya, hamba, anak-anak, orang, anak, maha, beriman, saudara, perempuan-perempuan, harta, miliki"
35,20,"allah, orang-orang, beriman, takut, kaum, hati, rasul, berperang, engkau, kafir, maha, bagimu, orang, setan, niscaya"
35,21,"yusuf, orang, tujuh, engkau, tuhanku, kepadaku, orang-orang, allah, sapi, ekor, membawa, nabi, tangkai, qabil, gandum"
35,22,"allah, orang-orang, beriman, orang, maha, jalan, berbuat, pahala, harta, berperang, kepadamu, kebaikan, rasul-nya, menginfakkan, kerjakan"
35,23,"engkau, nabi, muhammad, allah, orang-orang, kepadamu, orang, seandainya, niscaya, berperang, maha, munafik, sungguh, kaum, perang"
35,24,"pohon, allah, orang-orang, kurma, mengeluarkan, kepadamu, kebun, surga, darinya, menumbuhkan, air, tercurah, buih, mun, alaikum"
35,25,"allah, kepadamu, nabi, engkau, muhammad, orang-orang, petunjuk, mengikuti, beriman, maha, manusia, perbuatan, berbuat, tuhanmu, kehendaki"
35,26,"nabi, muhammad, alquran, orang-orang, kepadamu, engkau, allah, kitab, sungguh, rasul, beriman, peringatan, benar-benar, kebenaran, pemberi"
35,27,"allah, bumi, maha, langit, malam, tanda-tanda, menjadikan, siang, menciptakan, benar-benar, kebesaran, kekuasaan, manusia, orang, memperhatikan"
35,28,"engkau, tuhan, tuhanku, musa, orang-orang, anak, maha, benar-benar, berdoa, alam, semesta, ibrahim, sapi, kaum, patung"
35,29,"engkau, musa, orang, orang-orang, kaum, fir'aun, negeri, benar-benar, ingatlah, israil, bani, sungguh, kaumnya, penduduk, berdua"
35,30,"orang-orang, allah, surga, neraka, dalamnya, beriman, kekal, sungai-sungai, mengalir, bawahnya, azab, tuhan, saleh, balasan, beramal"
35,31,"allah, bagimu, perempuan, istri, orang-orang, rumah, suami, maha, perempuan-perempuan, laki-laki, mahar, nabi, kafir, istri-istrimu, anak-anak"
35,32,"maha, allah, penyayang, bumi, pengampun, bijaksana, perkasa, langit, tuhan, kehendaki, tuhanmu, milik, kepada-nya, allahlah, suci"
35,33,"neraka, api, air, orang-orang, allah, minum, orang, besi, riba, minuman, azab, mendidih, panas, ternak, kufur"
35,34,"allah, orang-orang, kepadamu, nabi, kitab, isa, ibrahim, maryam, agama, taurat, putra, musa, muhammad, petunjuk, benar-benar"
40,0,"orang-orang, allah, kaum, azab, kafir, niscaya, sungguh, benar-benar, orang, rasul, kepadamu, seandainya, mendustakan, kufur, nabi"
40,1,"allah, orang-orang, beriman, jalan, saleh, pahala, niscaya, orang, beramal, bertakwa, surga, sisi, rezeki, berperang, berbuat"
40,2,"allah, orang-orang, dunia, kehidupan, rezeki, akhirat, harta, beriman, mencari, kehendaki, berbuat, karunia, neraka, azab, benar-benar"
40,3,"engkau, maha, orang, tuhan, orang-orang, allah, mendengar, tuhanku, berdoa, muhammad, kepadaku, tuhannya, takut, dosa, nabi"
40,4,"engkau, nabi, muhammad, petunjuk, allah, alquran, kehendaki, orang, orang-orang, maha, kepadamu, berdasarkan, bahasa, mengikuti, hati"
40,5,"allah, petunjuk, orang-orang, orang, manusia, jalan, bumi, tuhan, lurus, maha, muhammad, kufur, menciptakan, menjadikan, wajahmu"
40,6,"allah, tuhan, maha, nabi, muhammad, bumi, langit, engkau, orang-orang, kepada-nya, kepadaku, kepadamu, suci, menjadikan, tuhanmu"
40,7,"allah, orang-orang, nabi, muhammad, beriman, engkau, mukmin, munafik, rasul-nya, kepadamu, orang, kafir, hati, berperang, takut"
40,8,"pohon, kurma, allah, kebun, air, menumbuhkan, tanaman, benar-benar, anggur, warnanya, kaum, kebesaran, makanlah, buah, perumpamaan"
40,9,"orang-orang, allah, beriman, azab, orang, kaum, sungguh, ayat-ayat, engkau, kafir, nabi, muhammad, menjadikan, zalim, petunjuk"
40,10,"allah, bumi, maha, langit, tanda-tanda, orang-orang, benar-benar, kebesaran, menciptakan, menjadikan, kekuasaan, siang, malam, kaum, kehendaki"
40,11,"orang-orang, azab, engkau, allah, tuhan, nabi, muhammad, kaum, tuhanmu, unta, betina, kepadamu, zalim, ditimpa, menjadikan"
40,12,"allah, orang-orang, maha, bagimu, harta, kafir, mahar, perempuan-perempuan, orang, dosa, beriman, pakaian, miskin, halal, berikanlah"
40,13,"allah, orang, orang-orang, saksi, kesaksian, dosa, berbuat, adil, kepadamu, perbuatan, maha, beriman, nama, bersumpah, batas"
40,14,"engkau, berfirman, ingatlah, gunung, musa, malaikat, api, iblis, allah, tanah, tuhanmu, golongan, bersujud, tuhannya, niscaya"
40,15,"allah, kaum, benar-benar, engkau, tuhan, kaumku, sungguh, nyata, musa, kaumnya, ingatlah, nuh, kepadamu, bagimu, bukti"
40,16,"allah, orang-orang, kepadamu, manusia, sungguh, tuhanmu, nabi, rasul, engkau, muhammad, benar-benar, ayat-ayat, orang, mengikuti, kebenaran"
40,17,"allah, anak, orang-orang, gembira, kabar, yusuf, ibrahim, negeri, ingatlah, maha, membawa, kepadamu, musa, sapi, menahan"
40,18,"allah, orang-orang, kepadamu, ibrahim, ingatlah, manusia, agama, berfirman, nabi, menjadikan, menganugerahkan, sungguh, tuhan, kitab, maryam"
40,19,"allah, setan, orang-orang, golongan, musuh, berdua, bagimu, jalan, indah, salat, dosa, mengikuti, ketahuilah, beriman, surga"
40,20,"tujuh, orang-orang, engkau, sapi, kepadamu, tangkai, ekor, orang, semoga, keselamatan, mun, alaikum, tercurah, sal, allah"
40,21,"musa, fir'aun, negeri, engkau, orang, orang-orang, israil, bani, kaum, bumi, penduduk, fir, aun, ingatlah, bala"
40,22,"nabi, muhammad, alquran, kepadamu, orang-orang, kitab, engkau, allah, peringatan, diturunkan, beriman, kebenaran, sungguh, benar-benar, pemberi"
40,23,"allah, maha, kepadamu, sungguh, benar-benar, malaikat, manusia, tuhanmu, langit, hati, berfirman, bumi, kitab, nyata, ingatlah"
40,24,"maha, allah, penyayang, pengampun, perkasa, bijaksana, bumi, kehendaki, orang-orang, tuhanmu, tobat, niscaya, langit, berbuat, mengampuni"
40,25,"neraka, orang-orang, azab, allah, jahanam, dalamnya, kufur, kekal, kiamat, dunia, api, kafir, tuhan, surga, orang"
40,26,"allah, orang, tanah, air, manusia, berfirman, mati, kepadamu, cahaya, burung, ingatlah, sempurna, menciptakan, engkau, menjadikan"
40,27,"allah, engkau, orang, air, negeri, muhammad, orang-orang, nabi, tinggal, niscaya, mati, hidup, maha, kepadamu, seratus"
40,28,"engkau, musa, yusuf, berdua, sungguh, saudaranya, kepadamu, benar-benar, harun, membawa, kepadaku, tipu, fir'aun, orang, tuhanmu"
40,29,"orang-orang, allah, orang, berbuat, dunia, azab, akhirat, bumi, nabi, balasan, kehidupan, kebaikan, benar-benar, engkau, kerusakan"
40,30,"allah, orang-orang, hamba, orang, sahaya, mukmin, beriman, maha, bagimu, ketentuan, miskin, wajib, perempuan, berpuasa, kepadamu"
40,31,"allah, maha, orang-orang, kepadamu, manusia, perang, sungguh, benar-benar, berbuat, bagimu, dirimu, muhammad, kebaikan, jalan, engkau"
40,32,"perempuan, laki-laki, anak, saudara, allah, harta, anak-anak, orang, rumah, saudara-saudara, perempuan-perempuan, maha, hamba, sahaya, miliki"
40,33,"allah, orang-orang, engkau, golongan, menginfakkan, kepadamu, seandainya, niscaya, berbuat, manusia, orang, takut, jalan, kekuatan, tuhanku"
40,34,"air, langit, hujan, bumi, allah, menurunkan, mati, menjadikan, angin, awan, gunung-gunung, dengannya, engkau, menciptakan, kering"
40,35,"allah, orang-orang, beriman, harta, agama, orang, jalan, kepadamu, janji, kitab, rasul-nya, berjihad, bertakwalah, diturunkan, kiamat"
40,36,"allah, hewan, daging, orang, ternak, nama, disembelih, batas, memakan, maha, diharamkan, untukmu, bagimu, harta, menyebut"
40,37,"malam, siang, matahari, angin, engkau, tanda-tanda, tuhanmu, allah, kebesaran, menzalimi, kebun, salat, kaum, kepada-nya, bertasbihlah"
40,38,"orang-orang, allah, beriman, salat, orang, berbuat, maha, ibrahim, tuhan, zakat, isa, maryam, ingatlah, menunaikan, ismail"
40,39,"orang-orang, surga, allah, dalamnya, sungai-sungai, mengalir, bawahnya, kekal, beriman, surga-surga, rida, kemenangan, tuhan, saleh, memperoleh"
45,0,"orang-orang, allah, orang, dosa, beriman, kufur, kafir, azab, kiamat, mendengar, hati, ayat-ayat, sungguh, buruk, kekufuran"
45,1,"allah, azab, tuhan, kepadamu, neraka, dunia, kiamat, mengingkari, manusia, dalamnya, kerjakan, sungguh, hati, salam, siksaan"
45,2,"perempuan, laki-laki, allah, sahaya, anak-anak, hamba, saudara, rumah, orang-orang, saudara-saudara, miliki, perempuan-perempuan, beriman, mukmin, ibumu"
45,3,"allah, orang-orang, nabi, muhammad, engkau, maha, batas, melampaui, hati, orang, rezeki, kepadamu, beriman, benar-benar, sisi"
45,4,"allah, orang-orang, maha, beriman, kerjakan, pahala, surga, balasan, saleh, sisi, mengalir, kepada-nya, sungai-sungai, rezeki, perempuan"
45,5,"tipu, daya, orang-orang, nabi, muhammad, allah, kepadamu, sungguh, benar-benar, alquran, engkau, beriman, niscaya, bahasa, tangan"
45,6,"allah, tuhanmu, manusia, orang, orang-orang, nikmat, berlaku, jin, manakah, golongan, berbuat, negeri, dustakan, engkau, adil"
45,7,"nabi, muhammad, orang-orang, allah, orang, engkau, azab, rasul, sungguh, kebenaran, kepadamu, beriman, tuhan, mendustakan, pemberi"
45,8,"anak, perempuan, harta, saudara, orang, laki-laki, allah, ditinggalkan, meninggal, ayah, maha, wasiat, tua, dipenuhi, suami"
45,9,"allah, orang-orang, orang, salat, jalan, berperang, mukmin, beriman, harta, muhammad, nabi, maha, perang, rasul-nya, kepadamu"
